{
  "coop": false,
  "description": {
    "ar": "يمكنك الحصول على <sprite name=\"icon_RedHeart\"> إضافي",
    "de": "Erhalte ein zusätzliches <sprite name=\"icon_RedHeart\">",
    "en": "Gain an extra <sprite name=\"icon_RedHeart\">",
    "es": "Gana un <sprite name=\"icon_RedHeart\"> extra.",
    "fr": "Octroie un <sprite name=\"icon_RedHeart\"> supplémentaire.",
    "fr-CA": "Octroie un <sprite name=\"icon_RedHeart\"> supplémentaire.",
    "it": "Ottieni un cuore rosso <sprite name=\"icon_RedHeart\"> aggiuntivo.",
    "ja": "<sprite name=\"icon_RedHeart\"> を追加で1つ獲得する。",
    "ko": "추가로 하나의 <sprite name=\"icon_RedHeart\">를 얻습니다",
    "nl": "Verdien een extra <sprite name=\"icon_RedHeart\">",
    "pt-BR": "Ganhe um <sprite name=\"icon_RedHeart\"> extra.",
    "ru": "Вы получаете <sprite name=\"icon_RedHeart\">.",
    "tr": "Bir ilave <sprite name=\"icon_RedHeart\"> kazanırsın.",
    "zh-CN": "获得额外的<sprite name=\"icon_RedHeart\">",
    "zh-TW": "獲得額外的 <sprite name=\"icon_RedHeart\">"
  },
  "descriptionPlain": {
    "ar": "يمكنك الحصول على إضافي",
    "de": "Erhalte ein zusätzliches",
    "en": "Gain an extra",
    "es": "Gana un extra.",
    "fr": "Octroie un supplémentaire.",
    "fr-CA": "Octroie un supplémentaire.",
    "it": "Ottieni un cuore rosso aggiuntivo.",
    "ja": "を追加で1つ獲得する。",
    "ko": "추가로 하나의 를 얻습니다",
    "nl": "Verdien een extra",
    "pt-BR": "Ganhe um extra.",
    "ru": "Вы получаете.",
    "tr": "Bir ilave kazanırsın.",
    "zh-CN": "获得额外的",
    "zh-TW": "獲得額外的"
  },
  "dlc": false,
  "groups": [],
  "icon": "icons/tarot/Hearts2.png",
  "id": "Hearts2",
  "levels": [],
  "lore": {
    "ar": "دواء.",
    "de": "Ein Heilmittel.",
    "en": "A remedy.",
    "es": "Una cura.",
    "fr": "Un remède.",
    "fr-CA": "Un remède.",
    "it": "Un rimedio.",
    "ja": "癒し。",
    "ko": "치료약이다.",
    "nl": "Een remedie.",
    "pt-BR": "Uma reparação.",
    "ru": "Лекарство.",
    "tr": "Yaralara iyi gelir.",
    "zh-CN": "治疗。",
    "zh-TW": "治療。"
  },
  "maxLevel": 0,
  "name": {
    "ar": "القلوب II",
    "de": "Die Herzen II",
    "en": "The Hearts II",
    "es": "Los corazones II",
    "fr": "Le Cœur II",
    "fr-CA": "Le Cœur II",
    "it": "I cuori II",
    "ja": "心臓 II",
    "ko": "심장 II",
    "nl": "De harten II",
    "pt-BR": "Os Corações II",
    "ru": "Сердце II",
    "tr": "Kalpler II",
    "zh-CN": "红心 II",
    "zh-TW": "紅心 II"
  },
  "namePlain": {
    "ar": "القلوب II",
    "de": "Die Herzen II",
    "en": "The Hearts II",
    "es": "Los corazones II",
    "fr": "Le Cœur II",
    "fr-CA": "Le Cœur II",
    "it": "I cuori II",
    "ja": "心臓 II",
    "ko": "심장 II",
    "nl": "De harten II",
    "pt-BR": "Os Corações II",
    "ru": "Сердце II",
    "tr": "Kalpler II",
    "zh-CN": "红心 II",
    "zh-TW": "紅心 II"
  },
  "thumb": "icons/tarot/64/Hearts2.png",
  "weight": 60
}
