{
  "coop": false,
  "description": {
    "ar": "عليك إطلاق قذيفة مع كل ضربة بسلاحك. فترة الانتظار<br><color=#01D5A2>10ث</color>.",
    "de": "Feuere ein Projektil ab, wenn du deine Waffe schwingst <br><color=#01D5A2>10 Sek.</color> Abklingzeit.",
    "en": "Fire a projectile when you swing your weapon. <br><color=#01D5A2>10s</color> cooldown.",
    "es": "Dispara un proyectil cuando golpeas con tu arma <br><color=#01D5A2>10 s</color> de recarga.",
    "fr": "Tire un projectile lorsque vous utilisez votre arme. <br>Recharge : <color=#01D5A2>10 s</color>.",
    "fr-CA": "Tire un projectile lorsque vous utilisez votre arme. <br>Recharge : <color=#01D5A2>10 s</color>.",
    "it": "Lancia un proiettile quando sferri un fendente.<br>Tempo di recupero di <color=#01D5A2>10 s</color>.",
    "ja": "武器を振るうたびに魔弾を射出する。 <br>クールダウン： <color=#01D5A2>10秒</color>",
    "ko": "무기를 휘두를 때 투사체를 발사합니다<br>쿨타임 <color=#01D5A2>10초</color>.",
    "nl": "Schiet een projectiel als je met je wapen zwaait. <br> Cooldown van <color=#01D5A2>10 s</color>.",
    "pt-BR": "Atire um projétil quando usar sua arma <br><color=#01D5A2>10 seg.</color> de recarga.",
    "ru": "Вы выпускаете снаряд при взмахе оружием.<br>Перезарядка: <color=#01D5A2>10</color> сек.",
    "tr": "Silahını savurduğunda bir menzilli saldırı yaparsın. <br><color=#01D5A2>10 sn.</color> bekleme süresi.",
    "zh-CN": "挥舞武器时发射投射物<br>冷却时间 <color=#01D5A2>10 秒</color>。",
    "zh-TW": "你揮舞武器時發射投射物<br>冷卻時間 <color=#01D5A2>10 秒</color>。"
  },
  "descriptionPlain": {
    "ar": "عليك إطلاق قذيفة مع كل ضربة بسلاحك. فترة الانتظار\n10ث.",
    "de": "Feuere ein Projektil ab, wenn du deine Waffe schwingst\n10 Sek. Abklingzeit.",
    "en": "Fire a projectile when you swing your weapon.\n10s cooldown.",
    "es": "Dispara un proyectil cuando golpeas con tu arma\n10 s de recarga.",
    "fr": "Tire un projectile lorsque vous utilisez votre arme.\nRecharge: 10 s.",
    "fr-CA": "Tire un projectile lorsque vous utilisez votre arme.\nRecharge: 10 s.",
    "it": "Lancia un proiettile quando sferri un fendente.\nTempo di recupero di 10 s.",
    "ja": "武器を振るうたびに魔弾を射出する。\nクールダウン： 10秒",
    "ko": "무기를 휘두를 때 투사체를 발사합니다\n쿨타임 10초.",
    "nl": "Schiet een projectiel als je met je wapen zwaait.\nCooldown van 10 s.",
    "pt-BR": "Atire um projétil quando usar sua arma\n10 seg. de recarga.",
    "ru": "Вы выпускаете снаряд при взмахе оружием.\nПерезарядка: 10 сек.",
    "tr": "Silahını savurduğunda bir menzilli saldırı yaparsın.\n10 sn. bekleme süresi.",
    "zh-CN": "挥舞武器时发射投射物\n冷却时间 10 秒。",
    "zh-TW": "你揮舞武器時發射投射物\n冷卻時間 10 秒。"
  },
  "dlc": false,
  "groups": [],
  "icon": "icons/tarot/HandsOfRage.png",
  "id": "HandsOfRage",
  "levels": [
    {
      "description": {
        "ar": "عليك إطلاق قذيفة مع كل ضربة بسلاحك. فترة الانتظار<br><s>10ث</s> <color=#01D5A2>5ث</color>.",
        "de": "Feuere ein Projektil ab, wenn du deine Waffe schwingst <br><s>10 Sek.</s> <color=#01D5A2>5 Sek.</color> Abklingzeit.",
        "en": "Fire a projectile when you swing your weapon. <br><s>10s</s> <color=#01D5A2>5s</color> cooldown.",
        "es": "Dispara un proyectil cuando golpeas con tu arma <br><s>10 s</s> <color=#01D5A2>5 s</color> de recarga.",
        "fr": "Tire un projectile lorsque vous utilisez votre arme. <br>Recharge : <s>10 s</s> <color=#01D5A2>5 s</color>.",
        "fr-CA": "Tire un projectile lorsque vous utilisez votre arme. <br>Recharge : <s>10 s</s> <color=#01D5A2>5 s</color>.",
        "it": "Lancia un proiettile quando sferri un fendente.<br>Tempo di recupero di <s>10 s</s> <color=#01D5A2>5 s</color>.",
        "ja": "武器を振るうたびに魔弾を射出する。 <br>クールダウン： <s>10秒</s> <color=#01D5A2>5秒</color>",
        "ko": "무기를 휘두를 때 투사체를 발사합니다<br>쿨타임 <s>10초</s> <color=#01D5A2>5초</color>.",
        "nl": "Schiet een projectiel als je met je wapen zwaait. <br> Cooldown van <s>10 s</s> <color=#01D5A2>5 s</color>.",
        "pt-BR": "Atire um projétil quando usar sua arma <br><s>10 seg.</s> <color=#01D5A2>5 seg.</color> de recarga.",
        "ru": "Вы выпускаете снаряд при взмахе оружием.<br>Перезарядка: <s>10</s> <color=#01D5A2>5</color> сек.",
        "tr": "Silahını savurduğunda bir menzilli saldırı yaparsın. <br><s>10 sn.</s> <color=#01D5A2>5 sn.</color> bekleme süresi.",
        "zh-CN": "挥舞武器时发射投射物<br>冷却时间 <s>10 秒</s> <color=#01D5A2>5 秒</color>。",
        "zh-TW": "你揮舞武器時發射投射物<br>冷卻時間 <s>10 秒</s> <color=#01D5A2>5 秒</color>。"
      },
      "descriptionPlain": {
        "ar": "عليك إطلاق قذيفة مع كل ضربة بسلاحك. فترة الانتظار\n10ث 5ث.",
        "de": "Feuere ein Projektil ab, wenn du deine Waffe schwingst\n10 Sek. 5 Sek. Abklingzeit.",
        "en": "Fire a projectile when you swing your weapon.\n10s 5s cooldown.",
        "es": "Dispara un proyectil cuando golpeas con tu arma\n10 s 5 s de recarga.",
        "fr": "Tire un projectile lorsque vous utilisez votre arme.\nRecharge: 10 s 5 s.",
        "fr-CA": "Tire un projectile lorsque vous utilisez votre arme.\nRecharge: 10 s 5 s.",
        "it": "Lancia un proiettile quando sferri un fendente.\nTempo di recupero di 10 s 5 s.",
        "ja": "武器を振るうたびに魔弾を射出する。\nクールダウン： 10秒 5秒",
        "ko": "무기를 휘두를 때 투사체를 발사합니다\n쿨타임 10초 5초.",
        "nl": "Schiet een projectiel als je met je wapen zwaait.\nCooldown van 10 s 5 s.",
        "pt-BR": "Atire um projétil quando usar sua arma\n10 seg. 5 seg. de recarga.",
        "ru": "Вы выпускаете снаряд при взмахе оружием.\nПерезарядка: 10 5 сек.",
        "tr": "Silahını savurduğunda bir menzilli saldırı yaparsın.\n10 sn. 5 sn. bekleme süresi.",
        "zh-CN": "挥舞武器时发射投射物\n冷却时间 10 秒 5 秒。",
        "zh-TW": "你揮舞武器時發射投射物\n冷卻時間 10 秒 5 秒。"
      }
    }
  ],
  "lore": {
    "ar": "لا يمكن احتواء مثل هذا الغضب العارم.",
    "de": "Solch gewaltiger Zorn lässt sich nicht beherrschen.",
    "en": "Such violent wrath cannot be contained.",
    "es": "Una ira tan violenta no se puede contener.",
    "fr": "Une telle colère ne peut être contrôlée.",
    "fr-CA": "Une telle colère ne peut être contrôlée.",
    "it": "Un'ira tanto violenta da essere incontenibile.",
    "ja": "荒れ狂う怒りを抑え込むことはできず。",
    "ko": "이런 폭력적인 분노는 담고있을 수만은 없다.",
    "nl": "Een dergelijke gewelddadige furie kan niet worden beteugeld.",
    "pt-BR": "Tamanha fúria violenta não pode ser contida.",
    "ru": "Этот гнев невозможно сдержать.",
    "tr": "Böylesine vahşi bir gazabı kontrol etmek imkânsız.",
    "zh-CN": "无法压抑的盛怒。",
    "zh-TW": "無法壓抑的強烈盛怒。"
  },
  "maxLevel": 1,
  "name": {
    "ar": "أيادي السخط",
    "de": "Hände der Wut",
    "en": "Hands of Rage",
    "es": "Manos de ira",
    "fr": "Les Pattes furieuses",
    "fr-CA": "Les Pattes furieuses",
    "it": "Impugnatura iraconda",
    "ja": "憤怒の手",
    "ko": "분노의 손길",
    "nl": "De handen des toorns",
    "pt-BR": "Mãos Furiosas",
    "ru": "Длань ярости",
    "tr": "Öfkenin Elleri",
    "zh-CN": "狂怒之手",
    "zh-TW": "狂怒之手"
  },
  "namePlain": {
    "ar": "أيادي السخط",
    "de": "Hände der Wut",
    "en": "Hands of Rage",
    "es": "Manos de ira",
    "fr": "Les Pattes furieuses",
    "fr-CA": "Les Pattes furieuses",
    "it": "Impugnatura iraconda",
    "ja": "憤怒の手",
    "ko": "분노의 손길",
    "nl": "De handen des toorns",
    "pt-BR": "Mãos Furiosas",
    "ru": "Длань ярости",
    "tr": "Öfkenin Elleri",
    "zh-CN": "狂怒之手",
    "zh-TW": "狂怒之手"
  },
  "thumb": "icons/tarot/64/HandsOfRage.png",
  "weight": 50
}
