{
  "coop": true,
  "description": {
    "ar": "عند القتال بعيدًا عن الرفيق، تلحق <color=#01D5A2>2x</color> من ضرر السلاح.",
    "de": "Richte <color=#01D5A2>2x</color> so viel Waffenschaden an, wenn ihr weit voneinander entfernt kämpft.",
    "en": "When fighting far apart, deal <color=#01D5A2>2x</color> Weapon damage.",
    "es": "Cuando lucháis alejados, las armas infligen <color=#01D5A2>x2</color> de daño.",
    "fr": "Lorsque vous combattez à distance l'un de l'autre, dégâts des armes multipliés par <color=#01D5A2>2</color>.",
    "fr-CA": "Lorsque vous combattez à distance l'un de l'autre, dégâts des armes multipliés par <color=#01D5A2>2</color>.",
    "it": "Combattendo lontani, le armi infliggono il <color=#01D5A2>doppio</color> dei danni.",
    "ja": "お互いと遠く離れて戦っている間、武器で与えるダメージが<color=#01D5A2>2倍</color>になる。",
    "ko": "따로 싸울 때, 가하는 무기 피해량이 <color=#01D5A2>2x</color>배가 됩니다.",
    "nl": "Als je ver van elkaar af vecht, breng je <color=#01D5A2>2x</color> zoveel wapenschade toe.",
    "pt-BR": "Ao lutar longe de outro jogador, causa <color=#01D5A2>2x</color> o dano da arma.",
    "ru": "Вы наносите <color=#01D5A2>удвоенный</color> урон оружием, когда сражаетесь на расстоянии.",
    "tr": "Birbirinize uzak mesafede savaştığınızda <color=#01D5A2>2 kat</color> fazla silah hasarı verirsiniz.",
    "zh-CN": "远离彼此战斗时，武器伤害为 <color=#01D5A2>2 倍</color>。",
    "zh-TW": "遠離彼此戰鬥時，武器傷害為 <color=#01D5A2>2 倍</color>。"
  },
  "descriptionPlain": {
    "ar": "عند القتال بعيدًا عن الرفيق، تلحق 2x من ضرر السلاح.",
    "de": "Richte 2x so viel Waffenschaden an, wenn ihr weit voneinander entfernt kämpft.",
    "en": "When fighting far apart, deal 2x Weapon damage.",
    "es": "Cuando lucháis alejados, las armas infligen x2 de daño.",
    "fr": "Lorsque vous combattez à distance l'un de l'autre, dégâts des armes multipliés par 2.",
    "fr-CA": "Lorsque vous combattez à distance l'un de l'autre, dégâts des armes multipliés par 2.",
    "it": "Combattendo lontani, le armi infliggono il doppio dei danni.",
    "ja": "お互いと遠く離れて戦っている間、武器で与えるダメージが2倍になる。",
    "ko": "따로 싸울 때, 가하는 무기 피해량이 2x배가 됩니다.",
    "nl": "Als je ver van elkaar af vecht, breng je 2x zoveel wapenschade toe.",
    "pt-BR": "Ao lutar longe de outro jogador, causa 2x o dano da arma.",
    "ru": "Вы наносите удвоенный урон оружием, когда сражаетесь на расстоянии.",
    "tr": "Birbirinize uzak mesafede savaştığınızda 2 kat fazla silah hasarı verirsiniz.",
    "zh-CN": "远离彼此战斗时，武器伤害为 2 倍。",
    "zh-TW": "遠離彼此戰鬥時，武器傷害為 2 倍。"
  },
  "dlc": false,
  "groups": [
    "coop"
  ],
  "icon": "icons/tarot/CoopBetterApart.png",
  "id": "CoopBetterApart",
  "levels": [],
  "lore": {
    "ar": "المنافسة أعظم إلهام.",
    "de": "Der Wettkampf ist die größte Inspiration.",
    "en": "Competition is the greatest inspiration.",
    "es": "La competición es la mayor inspiración de todas.",
    "fr": "La compétition est la plus grande source d'inspiration.",
    "fr-CA": "La compétition est la plus grande source d'inspiration.",
    "it": "La competizione è la più grande ispirazione.",
    "ja": "競い合うこと、それが最大の活力となる。",
    "ko": "경쟁은 가장 훌륭한 영감을 가져다 준다.",
    "nl": "Competitie vormt de grootste inspiratie.",
    "pt-BR": "A desunião faz a força.",
    "ru": "Соперничество есть главный источник сил.",
    "tr": "Rekabet en büyük ilham kaynağıdır.",
    "zh-CN": "竞争是最好的启发。",
    "zh-TW": "競爭是最好的啟發。"
  },
  "maxLevel": 0,
  "name": {
    "ar": "الخصوم",
    "de": "Die Rivalen",
    "en": "The Rivals",
    "es": "Rivalidad",
    "fr": "Les Rivaux",
    "fr-CA": "Les Rivaux",
    "it": "I rivali",
    "ja": "好敵手",
    "ko": "경쟁자",
    "nl": "De rivalen",
    "pt-BR": "Os Rivais",
    "ru": "Соперники",
    "tr": "Hasımlar",
    "zh-CN": "敌手",
    "zh-TW": "敵手"
  },
  "namePlain": {
    "ar": "الخصوم",
    "de": "Die Rivalen",
    "en": "The Rivals",
    "es": "Rivalidad",
    "fr": "Les Rivaux",
    "fr-CA": "Les Rivaux",
    "it": "I rivali",
    "ja": "好敵手",
    "ko": "경쟁자",
    "nl": "De rivalen",
    "pt-BR": "Os Rivais",
    "ru": "Соперники",
    "tr": "Hasımlar",
    "zh-CN": "敌手",
    "zh-TW": "敵手"
  },
  "thumb": "icons/tarot/64/CoopBetterApart.png",
  "weight": 100
}
