{
  "coop": false,
  "description": {
    "ar": "يمكنك الحصول على <sprite name=\"icon_HalfRedHeart\"> إضافي",
    "de": "Erhalte ein zusätzliches <sprite name=\"icon_HalfRedHeart\">",
    "en": "Gain an extra <sprite name=\"icon_HalfRedHeart\">",
    "es": "Gana un <sprite name=\"icon_HalfRedHeart\"> extra.",
    "fr": "Octroie un <sprite name=\"icon_HalfRedHeart\"> supplémentaire.",
    "fr-CA": "Octroie un <sprite name=\"icon_HalfRedHeart\"> supplémentaire.",
    "it": "Ottieni mezzo cuore rosso <sprite name=\"icon_HalfRedHeart\"> aggiuntivo.",
    "ja": "<sprite name=\"icon_HalfRedHeart\"> を追加で獲得する。",
    "ko": "추가로 하나의 <sprite name=\"icon_HalfRedHeart\">를 얻습니다",
    "nl": "Verdien een extra <sprite name=\"icon_HalfRedHeart\">",
    "pt-BR": "Ganhe um <sprite name=\"icon_HalfRedHeart\"> extra.",
    "ru": "Вы получаете <sprite name=\"icon_HalfRedHeart\">.",
    "tr": "Bir ilave <sprite name=\"icon_HalfRedHeart\"> kazanırsın.",
    "zh-CN": "获得额外的<sprite name=\"icon_HalfRedHeart\">",
    "zh-TW": "獲得額外的 <sprite name=\"icon_HalfRedHeart\">"
  },
  "descriptionPlain": {
    "ar": "يمكنك الحصول على إضافي",
    "de": "Erhalte ein zusätzliches",
    "en": "Gain an extra",
    "es": "Gana un extra.",
    "fr": "Octroie un supplémentaire.",
    "fr-CA": "Octroie un supplémentaire.",
    "it": "Ottieni mezzo cuore rosso aggiuntivo.",
    "ja": "を追加で獲得する。",
    "ko": "추가로 하나의 를 얻습니다",
    "nl": "Verdien een extra",
    "pt-BR": "Ganhe um extra.",
    "ru": "Вы получаете.",
    "tr": "Bir ilave kazanırsın.",
    "zh-CN": "获得额外的",
    "zh-TW": "獲得額外的"
  },
  "dlc": false,
  "groups": [
    "default"
  ],
  "icon": "icons/tarot/Hearts1.png",
  "id": "Hearts1",
  "levels": [],
  "lore": {
    "ar": "دواء أساسي.",
    "de": "Ein kleines Heilmittel.",
    "en": "A minor remedy.",
    "es": "Una pequeña cura.",
    "fr": "Un remède peu efficace.",
    "fr-CA": "Un remède peu efficace.",
    "it": "Un rimedio poco efficace.",
    "ja": "軽度の癒し。",
    "ko": "미약한 치료약이다.",
    "nl": "Een kleine remedie.",
    "pt-BR": "Uma pequena reparação.",
    "ru": "Слабое лекарство.",
    "tr": "Ufak yaralara iyi gelir.",
    "zh-CN": "小幅治疗。",
    "zh-TW": "小幅治療。"
  },
  "maxLevel": 0,
  "name": {
    "ar": "القلوب I",
    "de": "Die Herzen I",
    "en": "The Hearts I",
    "es": "Los corazones I",
    "fr": "Le Cœur I",
    "fr-CA": "Le Cœur I",
    "it": "I cuori I",
    "ja": "心臓 I",
    "ko": "심장 I",
    "nl": "De harten I",
    "pt-BR": "Os Corações I",
    "ru": "Сердце I",
    "tr": "Kalpler I",
    "zh-CN": "红心 I",
    "zh-TW": "紅心 I"
  },
  "namePlain": {
    "ar": "القلوب I",
    "de": "Die Herzen I",
    "en": "The Hearts I",
    "es": "Los corazones I",
    "fr": "Le Cœur I",
    "fr-CA": "Le Cœur I",
    "it": "I cuori I",
    "ja": "心臓 I",
    "ko": "심장 I",
    "nl": "De harten I",
    "pt-BR": "Os Corações I",
    "ru": "Сердце I",
    "tr": "Kalpler I",
    "zh-CN": "红心 I",
    "zh-TW": "紅心 I"
  },
  "thumb": "icons/tarot/64/Hearts1.png",
  "weight": 50
}
