{
  "coop": false,
  "description": {
    "ar": "يمكنك تخطي صفين إلى الأمام في خريطة المغامرة.",
    "de": "Bewege dich auf der Abenteuerkarte zwei Reihen vorwärts.",
    "en": "Move 2 rows forward on the adventure map.",
    "es": "Avanzas 2 líneas en el mapa de la cruzada.",
    "fr": "Avancez de 2 zones sur la carte d'aventure.",
    "fr-CA": "Avancez de 2 zones sur la carte d'aventure.",
    "it": "Avanza di due file sul percorso dell'avventura.",
    "ja": "探索マップにおいて、2つ先の進度まで進む。",
    "ko": "모험 지도에서 앞으로 연속 2칸 이동합니다.",
    "nl": "Beweeg 2 rijen verder op de avontuurkaart.",
    "pt-BR": "Mova 2 linhas para a frente no mapa de aventura.",
    "ru": "Вы можете перемещаться на два ряда вперёд на карте.",
    "tr": "Macera haritasında 2 sıra ileri gidersin.",
    "zh-CN": "在冒险地图上向前移动 (2) 排。",
    "zh-TW": "在冒險地圖上向前移動 (2) 排。"
  },
  "descriptionPlain": {
    "ar": "يمكنك تخطي صفين إلى الأمام في خريطة المغامرة.",
    "de": "Bewege dich auf der Abenteuerkarte zwei Reihen vorwärts.",
    "en": "Move 2 rows forward on the adventure map.",
    "es": "Avanzas 2 líneas en el mapa de la cruzada.",
    "fr": "Avancez de 2 zones sur la carte d'aventure.",
    "fr-CA": "Avancez de 2 zones sur la carte d'aventure.",
    "it": "Avanza di due file sul percorso dell'avventura.",
    "ja": "探索マップにおいて、2つ先の進度まで進む。",
    "ko": "모험 지도에서 앞으로 연속 2칸 이동합니다.",
    "nl": "Beweeg 2 rijen verder op de avontuurkaart.",
    "pt-BR": "Mova 2 linhas para a frente no mapa de aventura.",
    "ru": "Вы можете перемещаться на два ряда вперёд на карте.",
    "tr": "Macera haritasında 2 sıra ileri gidersin.",
    "zh-CN": "在冒险地图上向前移动 (2) 排。",
    "zh-TW": "在冒險地圖上向前移動 (2) 排。"
  },
  "dlc": false,
  "groups": [
    "mystic"
  ],
  "icon": "icons/tarot/ExtraMove.png",
  "id": "ExtraMove",
  "levels": [],
  "lore": {
    "ar": "عسى أن تأتي الرياح بما تشتهي السفن.",
    "de": "Möge das Schicksal deine Segel füllen.",
    "en": "May fate fill your sails.",
    "es": "Que el destino empuje tus velas.",
    "fr": "Que le destin dirige votre voile.",
    "fr-CA": "Que le destin dirige votre voile.",
    "it": "Che la sorte gonfi le tue vele.",
    "ja": "運命が、あなたの航海の味方をしますように。",
    "ko": "운명이 그대의 돛을 밀길.",
    "nl": "Met het lot in de zeilen.",
    "pt-BR": "Que a sorte preencha sua vela.",
    "ru": "Да наполнит судьба ваши паруса.",
    "tr": "Yelkenlerine kader yön versin.",
    "zh-CN": "愿命运替你扬帆。",
    "zh-TW": "願命運替你使帆。"
  },
  "maxLevel": 0,
  "name": {
    "ar": "الرياح المواتية",
    "de": "Günstige Winde",
    "en": "Favourable Winds",
    "es": "Vientos propicios",
    "fr": "Vents favorables",
    "fr-CA": "Vents favorables",
    "it": "Venti favorevoli",
    "ja": "恵みの追い風",
    "ko": "호의로운 바람",
    "nl": "Gunstige winden",
    "pt-BR": "Vento Oportuno",
    "ru": "Попутный ветер",
    "tr": "Lütuf Rüzgârı",
    "zh-CN": "一帆风顺",
    "zh-TW": "一帆風順"
  },
  "namePlain": {
    "ar": "الرياح المواتية",
    "de": "Günstige Winde",
    "en": "Favourable Winds",
    "es": "Vientos propicios",
    "fr": "Vents favorables",
    "fr-CA": "Vents favorables",
    "it": "Venti favorevoli",
    "ja": "恵みの追い風",
    "ko": "호의로운 바람",
    "nl": "Gunstige winden",
    "pt-BR": "Vento Oportuno",
    "ru": "Попутный ветер",
    "tr": "Lütuf Rüzgârı",
    "zh-CN": "一帆风顺",
    "zh-TW": "一帆風順"
  },
  "thumb": "icons/tarot/64/ExtraMove.png",
  "weight": 100
}
