{
  "coop": false,
  "description": {
    "ar": "لم تعد الهجمات الثقيلة تتطلب حماسًا <sprite name=\"icon_blackSoul\">, تنخفض سرعة الحركة بنسبة <color=#01D5A2>25%.</color>",
    "de": "Schwere Angriffe benötigen keinen Eifer <sprite name=\"icon_blackSoul\"> mehr, Bewegungstempo wird um <color=#01D5A2>25 %</color> verringert.",
    "en": "Heavy attacks no longer require Fervour <sprite name=\"icon_blackSoul\">, movement speed is lowered by <color=#01D5A2>25%.</color>",
    "es": "Los ataques fuertes no gastan fervor <sprite name=\"icon_blackSoul\">, la velocidad de movimiento disminuye un <color=#01D5A2>25 %</color>.",
    "fr": "Les attaques lourdes ne dépensent plus de ferveur <sprite name=\"icon_blackSoul\">, la vitesse de déplacement est réduite de <color=#01D5A2>25 %.</color>",
    "fr-CA": "Les attaques lourdes ne dépensent plus de ferveur <sprite name=\"icon_blackSoul\">, la vitesse de déplacement est réduite de <color=#01D5A2>25 %.</color>",
    "it": "Gli attacchi pesanti non consumano più Fervore <sprite name=\"icon_blackSoul\">., la velocità di movimento è ridotta del <color=#01D5A2>25%</color>.",
    "ja": "強攻撃が信力 <sprite name=\"icon_blackSoul\"> を消費しなくなる、移動速度が <color=#01D5A2>25%</color> 低下する。",
    "ko": "강공격이 더 이상 열정 <sprite name=\"icon_blackSoul\">을 필요로 하지 않게 됩니다, 이동 속도가 <color=#01D5A2>25%.</color>만큼 감소됩니다.",
    "nl": "Voor zware aanvallen heb je geen furie meer nodig <sprite name=\"icon_blackSoul\">, bewegingssnelheid is verlaagd met <color=#01D5A2>25%</color>.",
    "pt-BR": "Ataques pesados não necessitam de Fervor <sprite name=\"icon_blackSoul\">, a velocidade de movimento é reduzida em <color=#01D5A2>25%.</color>",
    "ru": "Тяжёлые удары не требуют усердия <sprite name=\"icon_blackSoul\">, но вы передвигаетесь на <color=#01D5A2>25%</color> медленнее.",
    "tr": "Ağır saldırılar Şevk <sprite name=\"icon_blackSoul\"> tüketmez, hareket hızın <color=#01D5A2>%25</color> azalır.",
    "zh-CN": "重攻击不再需要热诚 <sprite name=\"icon_blackSoul\">，移动速度降低 <color=#01D5A2>25%</color>。",
    "zh-TW": "重攻擊不再需要熱誠 <sprite name=\"icon_blackSoul\">，移動速度降低 <color=#01D5A2>25%</color>。"
  },
  "descriptionPlain": {
    "ar": "لم تعد الهجمات الثقيلة تتطلب حماسًا, تنخفض سرعة الحركة بنسبة 25%.",
    "de": "Schwere Angriffe benötigen keinen Eifer mehr, Bewegungstempo wird um 25 % verringert.",
    "en": "Heavy attacks no longer require Fervour, movement speed is lowered by 25%.",
    "es": "Los ataques fuertes no gastan fervor, la velocidad de movimiento disminuye un 25 %.",
    "fr": "Les attaques lourdes ne dépensent plus de ferveur, la vitesse de déplacement est réduite de 25 %.",
    "fr-CA": "Les attaques lourdes ne dépensent plus de ferveur, la vitesse de déplacement est réduite de 25 %.",
    "it": "Gli attacchi pesanti non consumano più Fervore., la velocità di movimento è ridotta del 25%.",
    "ja": "強攻撃が信力 を消費しなくなる、移動速度が 25% 低下する。",
    "ko": "강공격이 더 이상 열정 을 필요로 하지 않게 됩니다, 이동 속도가 25%.만큼 감소됩니다.",
    "nl": "Voor zware aanvallen heb je geen furie meer nodig, bewegingssnelheid is verlaagd met 25%.",
    "pt-BR": "Ataques pesados não necessitam de Fervor, a velocidade de movimento é reduzida em 25%.",
    "ru": "Тяжёлые удары не требуют усердия, но вы передвигаетесь на 25% медленнее.",
    "tr": "Ağır saldırılar Şevk tüketmez, hareket hızın %25 azalır.",
    "zh-CN": "重攻击不再需要热诚 ，移动速度降低 25%。",
    "zh-TW": "重攻擊不再需要熱誠 ，移動速度降低 25%。"
  },
  "dlc": false,
  "groups": [
    "corrupted"
  ],
  "icon": "icons/tarot/CorruptedHeavy.png",
  "id": "CorruptedHeavy",
  "levels": [],
  "lore": {
    "ar": "عليك السير بين العاديين.",
    "de": "Wandle inmitten des Weltlichen.",
    "en": "Walk amongst the mundane.",
    "es": "Camina entre lo mundano.",
    "fr": "Marchez parmi le commun des mortels.",
    "fr-CA": "Marchez parmi le commun des mortels.",
    "it": "Scendi fra i vili terreni.",
    "ja": "凡人と変わらぬ者となれ。",
    "ko": "평범한 자들 사이를 걸으라.",
    "nl": "Wandel onder de aardelingen.",
    "pt-BR": "Caminhe entre os mortais.",
    "ru": "Чинно ступайте по этой бренной земле.",
    "tr": "Bazen fânilerin arasına karışmak gerekir.",
    "zh-CN": "行于世俗之中。",
    "zh-TW": "行於世俗之中。"
  },
  "maxLevel": 0,
  "name": {
    "ar": "العهد الفاني",
    "de": "Tödlicher Schwur",
    "en": "Mortal Oath",
    "es": "Juramento mortal",
    "fr": "Serment mortel",
    "fr-CA": "Serment mortel",
    "it": "Giuramento mortale",
    "ja": "定命の誓約",
    "ko": "필멸자의 맹세",
    "nl": "Dodelijke eed",
    "pt-BR": "Juramento Mortal",
    "ru": "Клятва смертности",
    "tr": "Fani Yemin",
    "zh-CN": "肉身誓言",
    "zh-TW": "肉身誓言"
  },
  "namePlain": {
    "ar": "العهد الفاني",
    "de": "Tödlicher Schwur",
    "en": "Mortal Oath",
    "es": "Juramento mortal",
    "fr": "Serment mortel",
    "fr-CA": "Serment mortel",
    "it": "Giuramento mortale",
    "ja": "定命の誓約",
    "ko": "필멸자의 맹세",
    "nl": "Dodelijke eed",
    "pt-BR": "Juramento Mortal",
    "ru": "Клятва смертности",
    "tr": "Fani Yemin",
    "zh-CN": "肉身誓言",
    "zh-TW": "肉身誓言"
  },
  "thumb": "icons/tarot/64/CorruptedHeavy.png",
  "weight": 100
}
