{
  "coop": false,
  "description": {
    "ar": "مناعة ضد التسمم.",
    "de": "Immun gegen Gift.",
    "en": "Immune to poison.",
    "es": "Inmune al veneno.",
    "fr": "Confère une immunité au poison.",
    "fr-CA": "Confère une immunité au poison.",
    "it": "Immunità al veleno.",
    "ja": "毒への耐性を得る。",
    "ko": "독에 면역이 됩니다.",
    "nl": "Immuun voor gif.",
    "pt-BR": "Imune a veneno.",
    "ru": "Вы не получаете урона от яда.",
    "tr": "Zehre karşı bağışıklık kazanırsın.",
    "zh-CN": "对毒免疫。",
    "zh-TW": "對毒免疫。"
  },
  "descriptionPlain": {
    "ar": "مناعة ضد التسمم.",
    "de": "Immun gegen Gift.",
    "en": "Immune to poison.",
    "es": "Inmune al veneno.",
    "fr": "Confère une immunité au poison.",
    "fr-CA": "Confère une immunité au poison.",
    "it": "Immunità al veleno.",
    "ja": "毒への耐性を得る。",
    "ko": "독에 면역이 됩니다.",
    "nl": "Immuun voor gif.",
    "pt-BR": "Imune a veneno.",
    "ru": "Вы не получаете урона от яда.",
    "tr": "Zehre karşı bağışıklık kazanırsın.",
    "zh-CN": "对毒免疫。",
    "zh-TW": "對毒免疫。"
  },
  "dlc": false,
  "groups": [],
  "icon": "icons/tarot/PoisonImmune.png",
  "id": "PoisonImmune",
  "levels": [],
  "lore": {
    "ar": "لا داعي للخوف مما يعبر شفتيك.",
    "de": "Fürchte nichts, was deine Lippen berührt.",
    "en": "Fear naught that passes thine lips.",
    "es": "No temas nada de lo que pasa por tus labios.",
    "fr": "Croquez la vie à pleines dents et sans crainte.",
    "fr-CA": "Croquez la vie à pleines dents et sans crainte.",
    "it": "Addenta la vita a morsi, senza timore alcuno.",
    "ja": "汝の唇を通るものを恐れることなかれ。",
    "ko": "그대의 입술을 따라 흐르는 것을 두려워하지 말지니.",
    "nl": "Vrees niet voor vergiftiging.",
    "pt-BR": "Não tema o que passa por teus lábios.",
    "ru": "Не бойтесь того, что вкушаете.",
    "tr": "Boğazından ne geçtiğine aldırma.",
    "zh-CN": "不再畏惧进入双唇的毒物。",
    "zh-TW": "畏懼穿越你雙唇的虛無。"
  },
  "maxLevel": 0,
  "name": {
    "ar": "المناعة السُمّية",
    "de": "Mithridatismus",
    "en": "Mithridatism",
    "es": "Mitridatismo",
    "fr": "Le Mithridatisme",
    "fr-CA": "Le Mithridatisme",
    "it": "Mitridatismo",
    "ja": "ミトリダート",
    "ko": "면독법",
    "nl": "Mithridatisme",
    "pt-BR": "Mitridatismo",
    "ru": "Митридатизм",
    "tr": "Mitridatizm",
    "zh-CN": "抗毒",
    "zh-TW": "抗毒"
  },
  "namePlain": {
    "ar": "المناعة السُمّية",
    "de": "Mithridatismus",
    "en": "Mithridatism",
    "es": "Mitridatismo",
    "fr": "Le Mithridatisme",
    "fr-CA": "Le Mithridatisme",
    "it": "Mitridatismo",
    "ja": "ミトリダート",
    "ko": "면독법",
    "nl": "Mithridatisme",
    "pt-BR": "Mitridatismo",
    "ru": "Митридатизм",
    "tr": "Mitridatizm",
    "zh-CN": "抗毒",
    "zh-TW": "抗毒"
  },
  "thumb": "icons/tarot/64/PoisonImmune.png",
  "weight": 50
}
