{
  "coop": false,
  "description": {
    "ar": "تزيل التأثيرات السلبية من الآثار وبطاقات التارو الفاسدة.",
    "de": "Entfernt die negativen Effekte von verdorbenen Relikten und Tarotkarten.",
    "en": "Removes the negative effects from corrupted Relics and Tarot Cards.",
    "es": "Elimina los efectos negativos de las reliquias o cartas del tarot corruptas.",
    "fr": "Supprime les effets négatifs des reliques et des cartes de tarot corrompues.",
    "fr-CA": "Supprime les effets négatifs des reliques et des cartes de tarot corrompues.",
    "it": "Rimuove gli effetti negativi delle reliquie e dei tarocchi corrotti.",
    "ja": "穢れた聖遺物とタロットカードからデメリットをなくす。",
    "ko": "저주받은 유물과 타로 카드의 부정적 효과를 제거합니다.",
    "nl": "Verwijdert de negatieve effecten van corrupte relikwieën en tarotkaarten.",
    "pt-BR": "Remove os efeitos negativos de Relíquias e Cartas de Tarô.",
    "ru": "Проклятые реликвии и карты Таро лишаются отрицательных эффектов.",
    "tr": "Yozlaşmış Yadigârlar ve Tarot Kartlarından olumsuz etkileri kaldırır.",
    "zh-CN": "移除受诅咒圣物与塔罗牌的负面效果。",
    "zh-TW": "移除受詛咒聖物與塔羅牌的負面效果。"
  },
  "descriptionPlain": {
    "ar": "تزيل التأثيرات السلبية من الآثار وبطاقات التارو الفاسدة.",
    "de": "Entfernt die negativen Effekte von verdorbenen Relikten und Tarotkarten.",
    "en": "Removes the negative effects from corrupted Relics and Tarot Cards.",
    "es": "Elimina los efectos negativos de las reliquias o cartas del tarot corruptas.",
    "fr": "Supprime les effets négatifs des reliques et des cartes de tarot corrompues.",
    "fr-CA": "Supprime les effets négatifs des reliques et des cartes de tarot corrompues.",
    "it": "Rimuove gli effetti negativi delle reliquie e dei tarocchi corrotti.",
    "ja": "穢れた聖遺物とタロットカードからデメリットをなくす。",
    "ko": "저주받은 유물과 타로 카드의 부정적 효과를 제거합니다.",
    "nl": "Verwijdert de negatieve effecten van corrupte relikwieën en tarotkaarten.",
    "pt-BR": "Remove os efeitos negativos de Relíquias e Cartas de Tarô.",
    "ru": "Проклятые реликвии и карты Таро лишаются отрицательных эффектов.",
    "tr": "Yozlaşmış Yadigârlar ve Tarot Kartlarından olumsuz etkileri kaldırır.",
    "zh-CN": "移除受诅咒圣物与塔罗牌的负面效果。",
    "zh-TW": "移除受詛咒聖物與塔羅牌的負面效果。"
  },
  "dlc": false,
  "groups": [
    "corrupted"
  ],
  "icon": "icons/tarot/NoCorruption.png",
  "id": "NoCorruption",
  "levels": [],
  "lore": {
    "ar": "كلمات منقية بأصوات هامسة ومدوية.",
    "de": "Worte der Läuterung, geflüstert und gebrüllt.",
    "en": "Words of cleansing, whispered and roared.",
    "es": "Palabras purificadoras, susurradas y aulladas.",
    "fr": "Des mots de purification, chuchotés puis rugis.",
    "fr-CA": "Des mots de purification, chuchotés puis rugis.",
    "it": "Parole purificatrici, sussurrate e ruggite.",
    "ja": "浄化の言葉は囁かれ、また叫ばれる。",
    "ko": "정화의 주문을 속삭이고 울부짖는다.",
    "nl": "Woorden van loutering, gefluisterd en gebruld.",
    "pt-BR": "Sussurros e rugidos de purificação.",
    "ru": "Слова очищения слышны в рыке и в шёпоте.",
    "tr": "Arındıran sözler; bazen fısıltı, bazen haykırış.",
    "zh-CN": "净化之词，以低声与高喊传达。",
    "zh-TW": "淨化之詞，以低聲與高喊傳達。"
  },
  "maxLevel": 0,
  "name": {
    "ar": "نظام النقاء",
    "de": "Ordnung der Reinheit",
    "en": "Order of Purity",
    "es": "Orden de pureza",
    "fr": "Ordre de pureté",
    "fr-CA": "Ordre de pureté",
    "it": "Ordine e purezza",
    "ja": "秩序の浄化",
    "ko": "순수의 기사단",
    "nl": "De orde der reinheid",
    "pt-BR": "Ordem da Pureza",
    "ru": "Заклинание чистоты",
    "tr": "Arındıran Düzen",
    "zh-CN": "纯洁之令",
    "zh-TW": "純潔之令"
  },
  "namePlain": {
    "ar": "نظام النقاء",
    "de": "Ordnung der Reinheit",
    "en": "Order of Purity",
    "es": "Orden de pureza",
    "fr": "Ordre de pureté",
    "fr-CA": "Ordre de pureté",
    "it": "Ordine e purezza",
    "ja": "秩序の浄化",
    "ko": "순수의 기사단",
    "nl": "De orde der reinheid",
    "pt-BR": "Ordem da Pureza",
    "ru": "Заклинание чистоты",
    "tr": "Arındıran Düzen",
    "zh-CN": "纯洁之令",
    "zh-TW": "純潔之令"
  },
  "thumb": "icons/tarot/64/NoCorruption.png",
  "weight": 100
}
