{
  "coop": false,
  "description": {
    "ar": "سيُسقط الأعداء <color=#01D5A2>2x</color> من الحماس <sprite name=\"icon_blackSoul\"> الإضافي",
    "de": "Gegner hinterlassen <color=#01D5A2>2 x</color> mehr Eifer <sprite name=\"icon_blackSoul\">",
    "en": "Enemies will drop <color=#01D5A2>2x</color> more Fervour <sprite name=\"icon_blackSoul\">",
    "es": "Los enemigos sueltan <color=#01D5A2>x2</color> más fervor <sprite name=\"icon_blackSoul\">.",
    "fr": "Permet de gagner <color=#01D5A2>2x</color> plus de ferveur <sprite name=\"icon_blackSoul\"> en tuant un ennemi.",
    "fr-CA": "Permet de gagner <color=#01D5A2>2x</color> plus de ferveur <sprite name=\"icon_blackSoul\"> en tuant un ennemi.",
    "it": "I nemici lasceranno cadere <color=#01D5A2>doppio</color> Fervore <sprite name=\"icon_blackSoul\">.",
    "ja": "敵がドロップする信力 <sprite name=\"icon_blackSoul\"> が <color=#01D5A2>2倍</color> になる。",
    "ko": "적들이 열정<sprite name=\"icon_blackSoul\">을 <color=#01D5A2>2배</color> 더 떨어뜨립니다.",
    "nl": "Vijanden laten <color=#01D5A2>2x</color> zoveel furie <sprite name=\"icon_blackSoul\"> vallen.",
    "pt-BR": "Inimigos soltam <color=#01D5A2>2x</color> mais Fervor <sprite name=\"icon_blackSoul\">",
    "ru": "Вы получаете в <color=#01D5A2>2</color> раза больше усердия <sprite name=\"icon_blackSoul\"> при убийстве врагов.",
    "tr": "Düşmanlardan <color=#01D5A2>2 kat</color> fazla Şevk <sprite name=\"icon_blackSoul\"> çıkar.",
    "zh-CN": "敌人将掉落 <color=#01D5A2>2 倍</color>的热诚<sprite name=\"icon_blackSoul\">",
    "zh-TW": "敵人將掉落 <color=#01D5A2>2 倍</color>的熱誠 <sprite name=\"icon_blackSoul\">"
  },
  "descriptionPlain": {
    "ar": "سيُسقط الأعداء 2x من الحماس الإضافي",
    "de": "Gegner hinterlassen 2 x mehr Eifer",
    "en": "Enemies will drop 2x more Fervour",
    "es": "Los enemigos sueltan x2 más fervor.",
    "fr": "Permet de gagner 2x plus de ferveur en tuant un ennemi.",
    "fr-CA": "Permet de gagner 2x plus de ferveur en tuant un ennemi.",
    "it": "I nemici lasceranno cadere doppio Fervore.",
    "ja": "敵がドロップする信力 が 2倍 になる。",
    "ko": "적들이 열정을 2배 더 떨어뜨립니다.",
    "nl": "Vijanden laten 2x zoveel furie vallen.",
    "pt-BR": "Inimigos soltam 2x mais Fervor",
    "ru": "Вы получаете в 2 раза больше усердия при убийстве врагов.",
    "tr": "Düşmanlardan 2 kat fazla Şevk çıkar.",
    "zh-CN": "敌人将掉落 2 倍的热诚",
    "zh-TW": "敵人將掉落 2 倍的熱誠"
  },
  "dlc": false,
  "groups": [
    "default"
  ],
  "icon": "icons/tarot/IncreaseBlackSoulsDrop.png",
  "id": "IncreaseBlackSoulsDrop",
  "levels": [
    {
      "description": {
        "ar": "سيُسقط الأعداء <s>2x‏</s> <color=#01D5A2>3x</color> من الحماس <sprite name=\"icon_blackSoul\"> الإضافي",
        "de": "Gegner hinterlassen <s>2 x</s> <color=#01D5A2>3 x</color> mehr Eifer <sprite name=\"icon_blackSoul\">",
        "en": "Enemies will drop <s>2x</s> <color=#01D5A2>3x</color> more Fervour <sprite name=\"icon_blackSoul\">",
        "es": "Los enemigos sueltan <s>x2</s> <color=#01D5A2>x3</color> más fervor <sprite name=\"icon_blackSoul\">.",
        "fr": "Permet de gagner <s>2x</s> <color=#01D5A2>3x</color> plus de ferveur <sprite name=\"icon_blackSoul\"> en tuant un ennemi.",
        "fr-CA": "Permet de gagner <s>2x</s> <color=#01D5A2>3x</color> plus de ferveur <sprite name=\"icon_blackSoul\"> en tuant un ennemi.",
        "it": "I nemici lasceranno cadere <s>doppio</s> <color=#01D5A2>triplo</color> Fervore <sprite name=\"icon_blackSoul\">.",
        "ja": "敵がドロップする信力 <sprite name=\"icon_blackSoul\"> が <s>2倍</s> <color=#01D5A2>3倍</color> になる。",
        "ko": "적들이 열정<sprite name=\"icon_blackSoul\">을 <s>2배</s> <color=#01D5A2>3배</color> 더 떨어뜨립니다.",
        "nl": "Vijanden laten <s>2x</s> <color=#01D5A2>3x</color> zoveel furie <sprite name=\"icon_blackSoul\"> vallen.",
        "pt-BR": "Inimigos soltam <s>2x</s> <color=#01D5A2>3x</color> mais Fervor <sprite name=\"icon_blackSoul\">",
        "ru": "Вы получаете в <s>2</s> <color=#01D5A2>3</color> раза больше усердия <sprite name=\"icon_blackSoul\"> при убийстве врагов.",
        "tr": "Düşmanlardan <s>2 kat</s> <color=#01D5A2>3 kat</color> fazla Şevk <sprite name=\"icon_blackSoul\"> çıkar.",
        "zh-CN": "敌人将掉落 <s>2 倍</s> <color=#01D5A2>3 倍</color>的热诚<sprite name=\"icon_blackSoul\">",
        "zh-TW": "敵人將掉落 <s>2 倍</s> <color=#01D5A2>3 倍</color>的熱誠 <sprite name=\"icon_blackSoul\">"
      },
      "descriptionPlain": {
        "ar": "سيُسقط الأعداء 2x‏ 3x من الحماس الإضافي",
        "de": "Gegner hinterlassen 2 x 3 x mehr Eifer",
        "en": "Enemies will drop 2x 3x more Fervour",
        "es": "Los enemigos sueltan x2 x3 más fervor.",
        "fr": "Permet de gagner 2x 3x plus de ferveur en tuant un ennemi.",
        "fr-CA": "Permet de gagner 2x 3x plus de ferveur en tuant un ennemi.",
        "it": "I nemici lasceranno cadere doppio triplo Fervore.",
        "ja": "敵がドロップする信力 が 2倍 3倍 になる。",
        "ko": "적들이 열정을 2배 3배 더 떨어뜨립니다.",
        "nl": "Vijanden laten 2x 3x zoveel furie vallen.",
        "pt-BR": "Inimigos soltam 2x 3x mais Fervor",
        "ru": "Вы получаете в 2 3 раза больше усердия при убийстве врагов.",
        "tr": "Düşmanlardan 2 kat 3 kat fazla Şevk çıkar.",
        "zh-CN": "敌人将掉落 2 倍 3 倍的热诚",
        "zh-TW": "敵人將掉落 2 倍 3 倍的熱誠"
      }
    }
  ],
  "lore": {
    "ar": "التقوّي بحماس أعدائك.",
    "de": "Labe dich an der Hingabe deiner Feinde.",
    "en": "Grow fat on the zeal of your foes.",
    "es": "Aliméntate del afán de tus enemigos.",
    "fr": "Nourrissez-vous de la faiblesse de vos ennemis.",
    "fr-CA": "Nourrissez-vous de la faiblesse de vos ennemis.",
    "it": "Saziati dello zelo dei nemici.",
    "ja": "汝が敵の信仰心を食らいて成長せよ。",
    "ko": "적들의 열정에서 살을 찌워 자라난다.",
    "nl": "Voed je met de ijver van je vijanden.",
    "pt-BR": "Tire vantagem do zelo de seus inimigos.",
    "ru": "Насыщайтесь горячностью своих врагов.",
    "tr": "Düşmanlarının hevesini kursağında bırak.",
    "zh-CN": "因为敌人的狂热而更加强大。",
    "zh-TW": "藉由敵人的狂熱更加壯大。"
  },
  "maxLevel": 1,
  "name": {
    "ar": "حصاد الحماس",
    "de": "Ernte des Eifers",
    "en": "Fervour's Harvest",
    "es": "Cosecha de fervor",
    "fr": "La Moisson de ferveur",
    "fr-CA": "La Moisson de ferveur",
    "it": "Mieti-Fervore",
    "ja": "豊穣なる信力",
    "ko": "열정 수확",
    "nl": "Oogst der furie",
    "pt-BR": "Colheita do Fervor",
    "ru": "Жатва усердия",
    "tr": "Şevk Hasadı",
    "zh-CN": "热诚大丰收",
    "zh-TW": "熱誠大豐收"
  },
  "namePlain": {
    "ar": "حصاد الحماس",
    "de": "Ernte des Eifers",
    "en": "Fervour's Harvest",
    "es": "Cosecha de fervor",
    "fr": "La Moisson de ferveur",
    "fr-CA": "La Moisson de ferveur",
    "it": "Mieti-Fervore",
    "ja": "豊穣なる信力",
    "ko": "열정 수확",
    "nl": "Oogst der furie",
    "pt-BR": "Colheita do Fervor",
    "ru": "Жатва усердия",
    "tr": "Şevk Hasadı",
    "zh-CN": "热诚大丰收",
    "zh-TW": "熱誠大豐收"
  },
  "thumb": "icons/tarot/64/IncreaseBlackSoulsDrop.png",
  "weight": 50
}
