{
  "coop": false,
  "description": {
    "ar": "يمكنك التضحية بتابع متعفن عند العودة إلى الحياة للعودة بصحة كاملة.",
    "de": "Opfere einen fauligen Anhänger, wenn du wiedererweckt wirst, um mit voller Gesundheit zurückzukehren.",
    "en": "Sacrifice a Rotten Follower when resurrecting yourself to return with full health.",
    "es": "Al revivir, sacrificas a un adepto putrefacto y recuperas toda la salud.",
    "fr": "Sacrificiez un adepte putréfié pour revenir à la vie avec tous vos cœurs.",
    "fr-CA": "Sacrificiez un adepte putréfié pour revenir à la vie avec tous vos cœurs.",
    "it": "Quando risorgi, sacrifica un membro del Culto marcescente per tornare con la salute al massimo.",
    "ja": "復活の儀の生贄に腐敗している信者を選ぶと、体力を全回復して復活できる。",
    "ko": "부패한 추종자 1명을 번제로 바쳐 플레이어가 완전한 체력으로 부활합니다.",
    "nl": "Offer een verrotte volgeling op wanneer je jezelf tot leven wekt om terug te keren met volledige gezondheid.",
    "pt-BR": "Sacrifique um Seguidor Putrefato ao se ressuscitar para voltar com a saúde cheia.",
    "ru": "Вы можете пожертвовать гниющим последователем, чтобы возродиться с полным запасом здоровья.",
    "tr": "Dirilirken bir Çürük Takipçi'ni kurban ederek canın dolu biçimde diril.",
    "zh-CN": "牺牲一名腐烂的教徒后以全量生命值复活。",
    "zh-TW": "復活時獻祭一名腐爛的教徒，即可恢復全部生命值。"
  },
  "descriptionPlain": {
    "ar": "يمكنك التضحية بتابع متعفن عند العودة إلى الحياة للعودة بصحة كاملة.",
    "de": "Opfere einen fauligen Anhänger, wenn du wiedererweckt wirst, um mit voller Gesundheit zurückzukehren.",
    "en": "Sacrifice a Rotten Follower when resurrecting yourself to return with full health.",
    "es": "Al revivir, sacrificas a un adepto putrefacto y recuperas toda la salud.",
    "fr": "Sacrificiez un adepte putréfié pour revenir à la vie avec tous vos cœurs.",
    "fr-CA": "Sacrificiez un adepte putréfié pour revenir à la vie avec tous vos cœurs.",
    "it": "Quando risorgi, sacrifica un membro del Culto marcescente per tornare con la salute al massimo.",
    "ja": "復活の儀の生贄に腐敗している信者を選ぶと、体力を全回復して復活できる。",
    "ko": "부패한 추종자 1명을 번제로 바쳐 플레이어가 완전한 체력으로 부활합니다.",
    "nl": "Offer een verrotte volgeling op wanneer je jezelf tot leven wekt om terug te keren met volledige gezondheid.",
    "pt-BR": "Sacrifique um Seguidor Putrefato ao se ressuscitar para voltar com a saúde cheia.",
    "ru": "Вы можете пожертвовать гниющим последователем, чтобы возродиться с полным запасом здоровья.",
    "tr": "Dirilirken bir Çürük Takipçi'ni kurban ederek canın dolu biçimde diril.",
    "zh-CN": "牺牲一名腐烂的教徒后以全量生命值复活。",
    "zh-TW": "復活時獻祭一名腐爛的教徒，即可恢復全部生命值。"
  },
  "dlc": true,
  "groups": [
    "majorDlc",
    "rot"
  ],
  "icon": "icons/tarot/MutatedResurrectFullHealth.png",
  "id": "MutatedResurrectFullHealth",
  "levels": [],
  "lore": {
    "ar": "أين تكمن جذوة الحياة؟",
    "de": "Wo ist das Feuer des Lebens beheimatet?",
    "en": "Where does the fire of life reside within?",
    "es": "¿Dónde yace el fuego de la vida?",
    "fr": "Où réside le feu de la vie ?",
    "fr-CA": "Où se trouve le feu de la vie?",
    "it": "Dove arde il fuoco della vita?",
    "ja": "生命の炎とは、体のどこに宿るものなのだろうか？",
    "ko": "생명의 불꽃은 어디에 깃드는가?",
    "nl": "Waarin brandt het levensvuur?",
    "pt-BR": "Onde reside o fogo da vida?",
    "ru": "Где таится пламя жизни?",
    "tr": "Yaşam alevi nerede yanar?",
    "zh-CN": "生命之火于何处栖身？",
    "zh-TW": "生命之火的本質是什麼？"
  },
  "maxLevel": 0,
  "name": {
    "ar": "استنزاف الحياة",
    "de": "Gestohlene Galle",
    "en": "Stolen Bile",
    "es": "Bilis usurpada",
    "fr": "Bile dérobée",
    "fr-CA": "Bile dérobée",
    "it": "Bile rubata",
    "ja": "奪われた胆液",
    "ko": "도둑맞은 담즙",
    "nl": "Gestolen gal",
    "pt-BR": "Bile Roubada",
    "ru": "Похищенная желчь",
    "tr": "Çalıntı Safra",
    "zh-CN": "偷来胆汁",
    "zh-TW": "失竊膽汁"
  },
  "namePlain": {
    "ar": "استنزاف الحياة",
    "de": "Gestohlene Galle",
    "en": "Stolen Bile",
    "es": "Bilis usurpada",
    "fr": "Bile dérobée",
    "fr-CA": "Bile dérobée",
    "it": "Bile rubata",
    "ja": "奪われた胆液",
    "ko": "도둑맞은 담즙",
    "nl": "Gestolen gal",
    "pt-BR": "Bile Roubada",
    "ru": "Похищенная желчь",
    "tr": "Çalıntı Safra",
    "zh-CN": "偷来胆汁",
    "zh-TW": "失竊膽汁"
  },
  "thumb": "icons/tarot/64/MutatedResurrectFullHealth.png",
  "weight": 100
}
